job_title,company,job_location,job_summary,job_salary,post_date,today,job_url
"Business Analyst, Commercial Mortgage Operations",CMLS Financial,"Vancouver, BC","Business Intelligence: data gathering, analysis and research, identifying opportunities for process improvement and reporting.",,Posted30+ days ago,2022-07-01,https://ca.indeed.com/rc/clk?jk=3f570b55cbe8461e&fccid=75006dd589f3e419&vjs=3
Lead Business Intelligence Analyst,Fresh Prep,"Remote in Vancouver, BC","Experience in data consolidation, data migration, and creating data documentation.
Identify data needs to develop high-value, actionable reporting aimed at…",,Posted28 days ago,2022-07-01,https://ca.indeed.com/rc/clk?jk=b43400b4874dce0e&fccid=3fa0bcb7bae3afa2&vjs=3
"Business Analyst, Client Development",Central 1 Credit Union,"Hybrid remote in Vancouver, BC","Promoting the value and strategic features of Central 1's service offering through the delivery of ongoing communications, detailed analysis, and preparing…",,Posted30+ days ago,2022-07-01,https://ca.indeed.com/rc/clk?jk=de4955f5eb9ac9b6&fccid=9579d885a2b359cc&vjs=3
Competitive Intelligence Analyst,Carbon Engineering Ltd.,"Remote in Vancouver, BC","Support data and analytic requests; source, validate and analyze data, build models, synthesize insights, and present results utilizing written reports and…",,Posted30+ days ago,2022-07-01,https://ca.indeed.com/rc/clk?jk=aac81a34d890b6fe&fccid=cdb8d8e586239b40&vjs=3
"Analyst, Business Insights (Remote)",World Vision Canada,"Remote in Vancouver, BC","Minimum 4-5 years’ marketing analytics or data research experience.
S/he will proactively utilize data analysis systems to represent data for the Philanthropy…",,Posted30+ days ago,2022-07-01,https://ca.indeed.com/rc/clk?jk=e7feacd5e922d7b0&fccid=4854e96460a20478&vjs=3
Senior Web Analyst,Thinkific,"Remote in Vancouver, BC","Have 5+ years of experience in a data/data analysis environment.
Have experience accessing, transforming and summarizing data from a variety of sources,…",,Posted24 days ago,2022-07-01,https://ca.indeed.com/rc/clk?jk=d8482f6eb68d4298&fccid=d699314cf8d706e3&vjs=3
"Senior Market Intelligence Manager, TBS Business Intelligenc...",TELUS,"Vancouver, BC","Improve the voice of BI across the organization ensuring that BI has a say in product, systems, value chain and marketing designs.",,Posted14 days ago,2022-07-01,https://ca.indeed.com/rc/clk?jk=567c138d9e4b3715&fccid=ed81336789a877c2&vjs=3
Business Intelligence Lead,ProCogia,"Vancouver, BC","Business Intelligence is an interdisciplinary approach that utilizes data collection, extraction and tranformation in combination with data modeling to provide…",,Posted30+ days ago,2022-07-01,https://ca.indeed.com/company/ProCogia/jobs/Business-Intelligence-Lead-3d832980f9704ac2?fccid=b3e3dabad95297e4&vjs=3
TFMS Planning & Reporting Analyst,BGIS,"Vancouver, BC",Generates and compiles data from multiple data sources using various business intelligence tools and information management systems.,,Posted30+ days ago,2022-07-01,https://ca.indeed.com/rc/clk?jk=de3f8f8b33d7e5a8&fccid=84c23fbcabc14d59&vjs=3
Business Analyst and Project Support,BC Cancer Agency,"Temporarily Remote in Vancouver, BC",Participate in the formal data collection and analysis to help identify system deficiencies and/or operational inefficiencies in order to report and develop new…,,Posted30+ days ago,2022-07-01,https://ca.indeed.com/rc/clk?jk=62715f51ad1a154a&fccid=629f985b051162c8&vjs=3
Senior Workforce Claims Forecast Analyst,Definity,"Hybrid remote in Vancouver, BC",Ensures that abnormal historical data points are identified and used to adjust historical data used as input into forecasting models and normalizing information…,,Posted30+ days ago,2022-07-01,https://ca.indeed.com/rc/clk?jk=3886460172b535f6&fccid=236ef8b5fc73dcdc&vjs=3
Senior Business Analyst - Anaplan,QuadReal Property Group,"Vancouver, BC","This will include analyzing business requirements, procedures and data to establish processes and controls.
This will include assisting with design, development…",,Posted30+ days ago,2022-07-01,https://ca.indeed.com/rc/clk?jk=c959ac628082199d&fccid=4c0dd9bbeab79d21&vjs=3
"Senior Manager, Business Intelligence (BI)",Canucks Sports & Entertainment,"Vancouver, BC","Experience with data visualization tools.
Drive a culture of data informed decision making across the organization.
Hire, lead, and develop staff.",,Posted4 days ago,2022-07-01,https://ca.indeed.com/rc/clk?jk=5e47578fc0724b24&fccid=a2adf92b385a0e59&vjs=3
ICT Business Analyst,First Nations Education Steering Committee (FNESC),"Temporarily Remote in West Vancouver, BC","Strong data analysis, application troubleshooting, and writing skills;
An understanding of IS concepts, including data models (ERDs) and application…","$58,710 a year",Posted2 days ago,2022-07-01,https://ca.indeed.com/company/First-Nations-Education-Steering-Committee/jobs/Ict-Business-Analyst-5d81de19785d0a94?fccid=80936ffbbe2d18ef&vjs=3
"Manager, Business Intelligence",Nicola Wealth,"Remote in Vancouver, BC","Creating organized databases, reviewing and analyzing data from multiple internal and external sources – SQL querying and manipulating data and an understanding…",,Posted14 days ago,2022-07-01,https://ca.indeed.com/rc/clk?jk=c56a5a2e8861cbb5&fccid=d8663bce5b2fe9f3&vjs=3
Senior Consultant - Information Security Analyst,EY,"Remote in Vancouver, BC","Excellent analytical skills and knowledge of data analytics methods.
As a Senior Consultant, you'll develop, deliver and lead cybersecurity and IT risk client…",,Posted25 days ago,2022-07-01,https://ca.indeed.com/rc/clk?jk=7edff339da809e3f&fccid=1544766d4c2915b0&vjs=3
Prospect Development Analyst,Covenant House Vancouver,"Vancouver, BC","Knowledge of latest research products and ethical data collection strategies an asset.
Participate in donor strategy sessions and recommend research strategies…",,Posted8 days ago,2022-07-01,https://ca.indeed.com/rc/clk?jk=2ef1c9877c3b2c57&fccid=ba0981c59d573af8&vjs=3
Business Intelligence Developer,BlueShore Financial,"North Vancouver, BC","Participates in corporate data governance team to maintain and update frameworks and corporate processes.
University degree in Engineering, Computer Science or…",,Posted30 days ago,2022-07-01,https://ca.indeed.com/company/BlueShore-Financial/jobs/Business-Intelligence-Developer-d030ca08184371e1?fccid=be9414fd46d6c4d2&vjs=3
Sr. Business Analyst - Contract,O2E Brands,"Hybrid remote in Vancouver, BC",Work collaboratively with other teams to document data integration requirements between the target ERP system and other platforms.,,Posted23 days ago,2022-07-01,https://ca.indeed.com/rc/clk?jk=36c6f6fc444e3206&fccid=47b2425a6076f68f&vjs=3
"Business Analyst, Residential Mortgages",Intellifi Corporation,"Vancouver, BC","Liaison between department end-users, technical analysts, IT analysts, consultants and external vendors to best support change management strategy.",,Posted30+ days ago,2022-07-01,https://ca.indeed.com/rc/clk?jk=a05129c72f94d454&fccid=b22dbee9f903270c&vjs=3
"Distribution & Logistics - Sr Analyst, Outbound Logistics",Aritzia,"New Westminster, BC","Successful candidates will be equally comfortable with both business process and data.
The mission of the Outbound Logistics Department is to manage the…",,Posted30+ days ago,2022-07-01,https://ca.indeed.com/rc/clk?jk=cdd46955b23649c6&fccid=230bf53df7c46c1a&vjs=3
"Business Analyst, System Optimization",Fraser Health,"Surrey, BC","Ensures data is effectively gathered, mined and leveraged to support effective decision making in support of corporate strategies and provide quality assurance…",,Posted30+ days ago,2022-07-01,https://ca.indeed.com/rc/clk?jk=da7986019638488c&fccid=7b6e906d0289e400&vjs=3
"Senior Business Analyst, BCX Process Management Team (SMB)",TELUS,"Vancouver, BC","Utilize data analytics tools and techniques for data mining and data reporting to stakeholders through strong story-telling.
7+ years of equivalent experience.",,Posted30+ days ago,2022-07-01,https://ca.indeed.com/rc/clk?jk=46d879d5ad2629f7&fccid=ed81336789a877c2&vjs=3
"Technical Product Manager – Data, Reporting and Business Int...",Global Relay,"Hybrid remote in Vancouver, BC","Experience with reporting, analytics and big data concepts.
The Product Management team is responsible for executing product strategy, prioritizing and aligning…",,Posted30+ days ago,2022-07-01,https://ca.indeed.com/rc/clk?jk=1cea55cdb5ef473b&fccid=0d3fa1b8c4aea5ad&vjs=3
IT (INFORMATION TECHNOLOGY) BUSINESS ANALYST,West Fraser Mills Ltd,"Vancouver, BC","Assess physical and technical security risks to data, software and hardware.
Credentials (certificates, licences, memberships, courses, etc.).","$80,000–$90,000 a year",Posted9 days ago,2022-07-01,https://ca.indeed.com/rc/clk?jk=3dbd25b59b81adaf&fccid=2d6618af508c37db&vjs=3
"Specialist, Business Intelligence - BC Cancer Vancouver",PHSA,"Vancouver, BC",Lead the identification of new data sources and implement data extraction routines from departmental feeder systems.,,Posted2 days ago,2022-07-01,https://ca.indeed.com/rc/clk?jk=bd842a12ad8f8602&fccid=f66f721a44de3765&vjs=3
"Manager, Budget, Analysis & Business Intelligence",British Columbia Institute of Technology (BCIT),"Hybrid remote in Burnaby, BC","Manages and carries out research of best practice, trends and methods, and recommends appropriate application to reporting functions.",,Posted6 days ago,2022-07-01,https://ca.indeed.com/rc/clk?jk=dae8e5854a03de4f&fccid=a874193b682c9f05&vjs=3
Business Systems Analyst/ Azure,NR Consulting LLC,"Vancouver, BC","6-8 years of minimum BA experience in data analytics/data warehouse/data integration through agile environment.
Azure knowledge good to have.",,Posted30+ days ago,2022-07-01,https://ca.indeed.com/rc/clk?jk=87ba9703a4e62ef2&fccid=3800c35bb29ac508&vjs=3
Lead Salesforce Administrator & Business Analyst,MakeWay,"Remote in Vancouver, BC",Develop and maintain tools that monitor data hygiene and integrity of data and system processes across the organization.,"$59,823–$66,065 a year",Posted30+ days ago,2022-07-01,https://ca.indeed.com/rc/clk?jk=631af11163014c90&fccid=f5746cbfced44b22&vjs=3
"Doctor Preference Card (DPC) Clerk/Inventory Analyst, Operat...",Fraser Health,"Delta, BC","Participates in Sterile Processing Department's Quality Assurance Program by collecting data and providing input.
Knowledge of surgical and medical terminology.",,Posted30+ days ago,2022-07-01,https://ca.indeed.com/rc/clk?jk=23107775435deb3c&fccid=7b6e906d0289e400&vjs=3
Business System Analyst,Sonepar Canada,"Surrey, BC","Post-Secondary IT related diploma preferred.
Attractive compensation with benefits and “other perks” such as tuition reimbursement.",,Posted30+ days ago,2022-07-01,https://ca.indeed.com/rc/clk?jk=53d9009aee7ffa8a&fccid=e7442e64fecff50c&vjs=3
Senior Business Intelligence Analyst,Bosa Properties,"Vancouver, BC","Skilled in manipulating data and drawing insights from large data sets using the statistical tool will be considered an asset.
Coding fluency in Python or R.",Full-time,Posted7 days ago,2022-07-01,https://ca.indeed.com/rc/clk?jk=c912bde654414182&fccid=9a241dc97e4f4aef&vjs=3
Power BI Developer,AstraNorth,"Vancouver, BC","Connecting data sources, importing data, and transforming data for Business intelligence.
Expertise in building data visualizations with a strong understanding…","From $100,000 a year",Posted30+ days ago,2022-07-01,https://ca.indeed.com/company/AstraNorth/jobs/Power-Bi-Developer-9990c0e7fe55f8b4?fccid=8116154355837827&vjs=3
BI Engineer - Vancouver,Randstad,"Vancouver, BC","Good knowledge of Tableau, capable of preparing data source and data extract.
5+ years of experience processing large-scale distributed systems as pertains to…",,Posted30+ days ago,2022-07-01,https://ca.indeed.com/pagead/clk?mo=r&ad=-6NYlbfkN0DL1mgBEyOWwKTdt-fflRYWJGo3trZEDUBRi3gbejz7bSbolBeWktS2mvpjAwPmIiQ7uhe5Kypiy_8CG75KDGp0Xw_8Lgu01ARjvDPGgXwZDLJW-JEXxVC5n7twf0RPdhwUhLk4owCyWgKlpG1cjxUpDG0WKU_m_eAAxAfKRQE33NUpeJuKH9IsmPif-YpLo82_3SYx2yB7fvC95sMXaAudSU4m5YAZ_GVhd0PSE92N1oEY9H0a-z6qUq2aXjJEBtMyKIhuuS_Iyxx4hMs9HTV-cHiKyQta9hji2BcbgLBj6IjSbo4pXIG4Mp9zd-iXIsiEn6wSx1vZu8r7q36Skr5iX0Z6nZL29H25DzmK59QH5Pdl34zhcGOwBZhHLGxIp_q17JkJPWJKHo8FnAyDaL65_ZziB86l-FTmf2G6hDAOJ-QPXVhCw-h06NWyQ33K__52v7rSQOS4z4dHDQIOAfsSm4evPrIwNle5NgrBxiwm891-KJqr0fOpM5VTuD8kgvRKljQoeDrHiI-U1Y9cqrQi3_GZDJhd4Sz7EOliT-0ZFrA4tH0-keQxZ3jWLtaTBSDeJ_L8-3reszG7VgsbSGF1p_PhqKeZiwh3ppmPXf_dh4Ib0DH17iDXnZv0X8Db-y-WI_iry_0NrufGq5Y1GT8r3DlMAI5Z86d_5t7kocFPCP4j9Uy2n-rnAb4PsVE_FcXEF5c53mBHhw1pZgGKV4Hmxj36_3fY6sPagYbkJQhXXAM2gc9oOxzEj5eg0lD1-5gyFpBMPyDMUZ80Fw2QuFN_hEsTwHa4kd7ILI9G1OkAsDFhsH2zYKgSn0PH_ORqY3InSbJso4AbjPEPX9-joRJ1oDpCnDyLRPg0ILnUVH7K1hT5A1ac6ByWC7b0EAnxNy1_Ds2hqlNM4dZqYr9Zr1aUSI6LA6Wyp9s=&xkcb=SoAs-_M3ceGQMCydZZ0IbzkdCdPP&p=5&fvj=0&vjs=3
Manager Master Data & Business Intelligence,West Fraser,"Vancouver, BC","Create and execute plans to realize the data management and governance vision, which contains the following elements: data cleansing, data governance, data…",Full-time,Posted23 days ago,2022-07-01,https://ca.indeed.com/rc/clk?jk=a879a80e77d2f9f4&fccid=2d6618af508c37db&vjs=3
Senior Business Analyst - Small Business Insurance,BCAA,"Burnaby, BC","Ability to add value to all levels of discussion with key business stakeholders from idea inception through to execution.
MBA or Master’s level degree.",Part-time +1,EmployerActive 3 days ago,2022-07-01,https://ca.indeed.com/company/BCAA/jobs/Senior-Business-Analyst-c4077a9b44be525f?fccid=c3874ffbc0eac87d&vjs=3
Business Technology Analyst - OpenRoad Head Office,OpenRoad Auto Group,"Richmond, BC","Develop and implement technological solutions to improve performance and value, and expand the business model beyond conventional methods used in the industry.",Full-time,Posted6 days ago,2022-07-01,https://ca.indeed.com/rc/clk?jk=8c5c581a6614cb36&fccid=0103dd9a540bc14b&vjs=3
Senior Business Analyst,Fantuan Technology Ltd,"Burnaby, BC","3 Understand the business essence behind the data, mine data insights in different business scenarios, discover potential defects and opportunities, and provide…",Full-time,EmployerActive 9 days ago,2022-07-01,https://ca.indeed.com/company/Just-Order-Enterprise-Corp./jobs/Senior-Business-Analyst-c8c270a748e42583?fccid=d8ddff9f4870d4dd&vjs=3
"Software Engineer – Data Visualization (14841) - Vancouver,...",Getty Images,"Temporarily Remote in Vancouver, BC","Can comfortably craft or critique visual representations of data or data interfaces.
It will help elevate their experience when interacting with data and enable…",Full-time,Posted30+ days ago,2022-07-01,https://ca.indeed.com/rc/clk?jk=413ad5ebb9f463ac&fccid=c68f858ef73a0c44&vjs=3
"HIM Business Analyst, Strategic Planning & Projects",Providence Health Care,"Vancouver, BC","Ability to analyze and report statistical data.
Performs data collection and data analysis with internal staff and vendors to track volumes/reports, invoices,…",Full-time,Posted30+ days ago,2022-07-01,https://ca.indeed.com/rc/clk?jk=ef339bec0df4826b&fccid=e98b37c86f8eec83&vjs=3
Business Analyst - II,BCCNM,"Hybrid remote in Vancouver, BC",Sets up solution acceptance criteria; validates outputs and reviews the impact of implemented resolutions over time by gathering and analyzing user feedback to…,Full-time,Posted30+ days ago,2022-07-01,https://ca.indeed.com/rc/clk?jk=036e40ff901f0520&fccid=ebaa00840befb3cc&vjs=3
Tax Analyst,Global Relay,"Hybrid remote in Vancouver, BC","Assist the Manager, Tax with research of state and local tax legislation and its applicability to service and product offerings in order to conclude on sales…",,Posted30+ days ago,2022-07-01,https://ca.indeed.com/rc/clk?jk=622e7f8a770d9266&fccid=0d3fa1b8c4aea5ad&vjs=3
Business Intelligence (BI) Developer (Remote),Attabotics,"Remote in Vancouver, BC","We design, build, and maintain applications and SaaS solutions supporting our internal software, engineering, operations, and data analytics initiatives while…",Full-time,Posted30 days ago,2022-07-01,https://ca.indeed.com/rc/clk?jk=4845ec109c0714ad&fccid=a81303a2738c4d91&vjs=3
Tax Analyst,Global Relay,"Hybrid remote in Vancouver, BC","Assist the Manager, Tax with research of state and local tax legislation and its applicability to service and product offerings in order to conclude on sales…",,Posted30+ days ago,2022-07-01,https://ca.indeed.com/rc/clk?jk=622e7f8a770d9266&fccid=0d3fa1b8c4aea5ad&vjs=3
Business Intelligence (BI) Developer (Remote),Attabotics,"Remote in Vancouver, BC","We design, build, and maintain applications and SaaS solutions supporting our internal software, engineering, operations, and data analytics initiatives while…",,Posted30 days ago,2022-07-01,https://ca.indeed.com/rc/clk?jk=4845ec109c0714ad&fccid=a81303a2738c4d91&vjs=3
Senior Business Systems Analyst - Reliability 2.0,TELUS,"Burnaby, BC","Proficiency in developing test plans, test scripts, and the analysis of test results.
Working experience with Control-M scheduling software.",,Posted30+ days ago,2022-07-01,https://ca.indeed.com/rc/clk?jk=31cd26b996f0921d&fccid=ed81336789a877c2&vjs=3
Business Intelligence Analyst,Convoy Supply Ltd.,"Surrey, BC","Develop data cleansing rules for the company, reviewing and validating data.
Briefly describe your experience in data management.",,EmployerActive 17 days ago,2022-07-01,https://ca.indeed.com/company/Convoy-Supply-Ltd/jobs/Business-Intelligence-Analyst-5470affe0bdc7a49?fccid=a88d8d39df0f6f7c&vjs=3
"Senior Business Analyst, eHealth",First Nations Health Authority,"Metro Vancouver Regional District, BC","Coordinate surveying of First Nations communities and health partners to gather data;
Self-motivated, with the ability to come up with innovative solutions to…",,Posted30+ days ago,2022-07-01,https://ca.indeed.com/rc/clk?jk=4423cff067af43b0&fccid=1468513ebc10d6b8&vjs=3
Senior BI Data Architect,UserTesting,"Vancouver, BC","Assess the effectiveness and accuracy of new data sources, data points, and data gathering techniques.
Partner with data warehouse and data engineering teams to…",,Posted30+ days ago,2022-07-01,https://ca.indeed.com/rc/clk?jk=e5856baea3594ca4&fccid=b3d7e23ba33dc4c3&vjs=3
BI Developer-Analyst,Providence Health Care,"Vancouver, BC","Strong background in data architecture, data quality, data mapping, and data structures.
Provides technical direction and guidance to data analysts and/or other…",,Posted30+ days ago,2022-07-01,https://ca.indeed.com/rc/clk?jk=b2d38cfa60c40ec8&fccid=e98b37c86f8eec83&vjs=3
"Senior Business Analyst, PHIS - PHSA eHealth Program",PHSA,"Vancouver, BC","Conduct analysis related to data conversion routines and system interfaces for assigned applications.
Provide strategic planning support and change management…",,Posted5 days ago,2022-07-01,https://ca.indeed.com/rc/clk?jk=c987b61eb693ae3b&fccid=f66f721a44de3765&vjs=3
computer analyst,AYN IMMIGRATION SERVICES LTD.,"Surrey, BC","Assess physical and technical security risks to data, software and hardware.
Confer with clients to identify and document requirements.",$36.06 an hour,Posted30+ days ago,2022-07-01,https://ca.indeed.com/rc/clk?jk=04836da101dac103&fccid=0218f18e340fe300&vjs=3
Senior Business Analyst (Strategic Programs Governance - PMO...,TELUS,"Vancouver, BC","Interlock with marketing and implementation teams on metrics, performance in order to ensure our goals and objectives are clearly defined and aligned to TELUS…",,Posted30+ days ago,2022-07-01,https://ca.indeed.com/rc/clk?jk=a3cc211b93034615&fccid=ed81336789a877c2&vjs=3
"Senior Business Analyst, Redevelopment Team - BC Cancer - Bu...",PHSA,"Burnaby, BC","Facilitate consensus on issues, including business design features, program changes, data requirements, privacy issues and reports.",,Posted30+ days ago,2022-07-01,https://ca.indeed.com/rc/clk?jk=27863bc4eb161a1e&fccid=f66f721a44de3765&vjs=3
Business Systems Analyst,Pure Sunfarms Corporation,"Delta, BC","Knowledge in reporting, integrations and master data is preferred.
As part our IT Business Solutions team, the Business Systems Analyst will provide application…",,Posted25 days ago,2022-07-01,https://ca.indeed.com/rc/clk?jk=6fcca394d0b54414&fccid=b4e878257a027286&vjs=3
"Business Analyst I, AWS Commerce Platform Business Operation...",Amazon Dev Centre Canada ULC,"Vancouver, BC","At least 1+ years of experience with data warehousing and reporting.
The ops analyst will support customer inquiries and contribute toward immediate resolution…",,Posted30+ days ago,2022-07-01,https://ca.indeed.com/rc/clk?jk=2653e8f31e9aee11&fccid=fe2d21eef233e94a&vjs=3
database analyst (DBA),Uponcall Inc.,"Surrey, BC","Operate database management systems to analyze data.
Design, construct, modify, implement and test data models and database management systems.",$38 an hour,Posted30+ days ago,2022-07-01,https://ca.indeed.com/rc/clk?jk=0382e4b187902ed3&fccid=4b778434a4d2e67c&vjs=3
"Faculty, Bachelor of Business Administration (BBA), Part-Tim...",British Columbia Institute of Technology (BCIT),"Burnaby, BC","Ability to excel under pressure and ‘think on your feet’.
BCIT’s School of Business is seeking a part-time studies Faculty, BBA program.",,Posted30+ days ago,2022-07-01,https://ca.indeed.com/rc/clk?jk=17e796b0cc70555e&fccid=a874193b682c9f05&vjs=3
"Senior Manager, Business Intelligence",Arc'teryx,"Remote in Vancouver, BC","Advocating for Data Mapping and Lineage, communicating when systems of records for enterprise data are unclear, and ensuring we develop single source of truth…",Full-time,Posted23 days ago,2022-07-01,https://ca.indeed.com/rc/clk?jk=a5d8ce9ec25638f4&fccid=c899d1c8c8e6ff07&vjs=3
Fibre Analyst,Paper Excellence,"Richmond, BC","Develops documentation of data sources, infrastructure, and reports to provide clarity and context for data consumers throughout the Fibre operation.",Full-time,Posted30+ days ago,2022-07-01,https://ca.indeed.com/rc/clk?jk=f3c18c9de875e8d8&fccid=e9e39e974f65eb1b&vjs=3
Senior Business Intelligence Professional,Definity,"Hybrid remote in Vancouver, BC","Develops and delivers complex reports & dashboards, providing clear data insights to business partners.
Collaborates with Data and Technology teams to improve…",Temporary +1,Posted30+ days ago,2022-07-01,https://ca.indeed.com/rc/clk?jk=968602495fabaf24&fccid=236ef8b5fc73dcdc&vjs=3
Business Analyst - Team Lead​,BCCNM,"Hybrid remote in Vancouver, BC",Sets up solution acceptance criteria; validates outputs and reviews the impact of implemented resolutions over time by gathering and analyzing user feedback to…,Full-time,Posted30+ days ago,2022-07-01,https://ca.indeed.com/rc/clk?jk=8f4c6d405b76859e&fccid=ebaa00840befb3cc&vjs=3
Senior SAP BI Report Developer/Analyst (Remote),Motorola Solutions,"Remote in Vancouver, BC","Experience with master data, data quality, or data migration projects and processes would be an asset.
Proven data analysis, data verification, and problem…",Full-time,Posted10 days ago,2022-07-01,https://ca.indeed.com/rc/clk?jk=108f3724c4ab773e&fccid=22ec6ef3cc441ac2&vjs=3
Senior Architect - Business Intelligence,Lululemon,"Vancouver, BC","Technical understanding of data model, data mapping, and data integration with a cross-functional mindset.
Your background will include a proven track record of…",,Posted30+ days ago,2022-07-01,https://ca.indeed.com/rc/clk?jk=76e78584fed4df2f&fccid=43f0f7dbd55927e9&vjs=3
"Senior Consultant, Data Integration and BI",Myers-Holum,"Remote in Vancouver, BC","3+ years experience with data warehouse and data integration projects, using ETL / data integration / data pipelining tools.",,Posted30+ days ago,2022-07-01,https://ca.indeed.com/rc/clk?jk=7633d7461f3332ef&fccid=545bc5c78669ff5f&vjs=3
Business Systems Analyst/Programmer,City of New Westminister,"New Westminster, BC","Business intelligence visualization tools, and data warehousing / data lakes would be an asset.
You have the ability to analyze and evaluate data and…","$81,779–$96,625 a year",Posted30+ days ago,2022-07-01,https://ca.indeed.com/rc/clk?jk=2df1c8e25d5d1852&fccid=7126edfd1fa28ab3&vjs=3
Senior Business Analyst - Chemical & Process Industry Domain,AstraNorth,"Vancouver, BC","*Comfortable with Data and Analytics products & Technologies* in used today for delivering KPIs and aware of SAP S/4 , Oracle etc.","From $140,000 a year",Posted30+ days ago,2022-07-01,https://ca.indeed.com/company/AstraNorth/jobs/Senior-Business-Analyst-57e006abd058d945?fccid=8116154355837827&vjs=3
"Senior Business Analyst, Business Intelligence - PHSA eHealt...",PHSA,"Vancouver, BC","Lead the analysis, design, and documentation of multi-dimensional data cubes, ETLs, BI reports, and interfaces to support the surveillance, health monitoring,…",Full-time,Posted20 days ago,2022-07-01,https://ca.indeed.com/rc/clk?jk=7f05bb451d623407&fccid=f66f721a44de3765&vjs=3
Data Visualization Specialist & Tableau Administrator - BC C...,PHSA,"Vancouver, BC","Builds cross-functional relationships with other teams, including the data warehousing team responsible for data mart development.
Job Type: Regular Full-Time.",Full-time,Posted30+ days ago,2022-07-01,https://ca.indeed.com/rc/clk?jk=23e746997cd41778&fccid=f66f721a44de3765&vjs=3
"Senior Business Analyst, Data Analytics, Reporting & Evaluat...",PHSA,"Vancouver, BC","Leads PHSA Enterprise Data Platform initiative in planning and performance monitoring through the development of reports, and data analysis from various data…",Full-time,Posted30 days ago,2022-07-01,https://ca.indeed.com/rc/clk?jk=7a67a7e49c360268&fccid=f66f721a44de3765&vjs=3
