job_title,company,job_location,job_summary,job_salary,post_date,today,job_url
Data Analyst Intern,Klue,"Remote in Vancouver, BC","Efficiency in data gathering and data cleaning.
As a data analyst intern, you will be focused on helping our insights team ensure our data providers and…",Full-time +1,Posted10 days ago,2022-07-01,https://ca.indeed.com/rc/clk?jk=b90cc6fa70e6fbd4&fccid=97d82e5ee0248fef&vjs=3
"Data Analyst, Courthouse Jury","Tyler Technologies, Inc.","Vancouver, BC","Previous experience in analyzing data.
Identifying patterns and trends in data sets.
Defining new data collection and analysis processes.",,Posted24 days ago,2022-07-01,https://ca.indeed.com/pagead/clk?mo=r&ad=-6NYlbfkN0CeE3Wp1M-8tH35RiH3f1Z9bIMggqs9mWwktycFHRXbIf7vsqZ4_y01ylFrHTYta8OTi0IiYX3gIyBQidV3857XGnKBKbCl_0h-ovZRGjPQ80Nd_YsQNSvMyHFdmYeWqoIiCUAhgK6XID8kwyRPWNTxkuvbrnaJ4BaFE0mhNmTQz5__9xY7sCAI-cAdHLQxDrRN0vVT7D4JmxTY9HJRhyFp6fHDpB_YRAd_nWZAQsIixcqIVlTE2h00YGcUBPqo3uihemwHHfgENVm2uaqRUSAZWqjHwIVy2nInkpgfLMxhQVTb3o-L9ItGMmerqG19SklhUHIhw_9lLLPDuYgXHk7h0Al_klsLaa2NMUuMKEefoSy-elaE5ztkh_-u-SWMbOsvy_EDWCQK-hyV5VQOLmXlOth5302ls2WXNbfNuJioLFsD1JfIouLVLK6tCUJ6PZct_uCn4H4YPrHAuzk4rXoG30BUXWN6xZj_1AaCFy3GJZMUnE6fD2JIndq-9HwIK4t7MdvRcxoWpVjEISIkLzn5EBT70OgIAdWrs7OnOqzCOwqTrdGWdY1R&xkcb=SoBA-_M3ceGSDQAK4r0LbzkdCdPP&p=1&fvj=0&vjs=3
Business Data Analyst Co-op Student,EMC Business Solutions LLP,"West Vancouver, BC","To provide all data needed for analyzing problems and important on business process.
The role also involves reviews opportunities that need to be improved…",$25 an hour,EmployerActive 5 days ago,2022-07-01,https://ca.indeed.com/pagead/clk?mo=r&ad=-6NYlbfkN0AbWYa3oiD4wDKvOm3HHMG1O5WE0eN4Zht-EpK7b45D64M9yc57xsoxkqSEPeD2eVi0U11aCPBhAITCdoeM38nTqRveYlyGVTC91gpwTLhtpU8IGhrRxSMoEoP2gXzFLM2HOCx8LWtLU6lxo-ODt3AFxbXk9MmisRbBx46cXtCPfvGBbWcxoz4g-f53l440OF-Ct1Y7CgcFxlzQdSrfjfsGMTctBuxWv124b2nsuJg3QrgtaDtOU3wIuwZ36yz5ecgwVgCUKmVPiSFd50Ec3YBAxYLf8vsK_WmiEBOt8MbHrRqEZXpQ25DbvKrtuwndNPWdejvpJ4l3OyD0LDUPPjeb9Z7DXZ5RQGQnGde7noS3vr9N33_tCKYO4EatjvRCC7bphAt0wO0xe5urb763EWoXgPfpt9Co6mTLHvkE3DePkGm_cJnY0lqhU1mp6NNQ1eL6hgWlZMVWuyhqsvX-YFcQiRM_IwPbFifO2PAbT1esPEJs8VD4ahjb61Yazt1u9Yw=&xkcb=SoB6-_M3ceGSDQAK4r0NbzkdCdPP&p=2&fvj=1&vjs=3
Senior Business Analyst (Business Intelligence)-Remote,Telus,"Remote in Vancouver, BC","Transformation program supporting it as a Business Systems Analyst.
TELUS International is looking for a qualified professional to fill a Business Systems…",Full-time,EmployerActive 4 days ago,2022-07-01,https://ca.indeed.com/pagead/clk?mo=r&ad=-6NYlbfkN0BoH16t8dIF4MKEIsnnjnCrHTawPdjOK3-tQg9UlhUP3AfuWqZkoGJNeNF8Ti-3b2Bs0PN8B8rBEGzhvS3XlTvQFW4dQAcqX-PLEFrJOP-iIt3t2MKJTyhTA6dyACgAKBAFqKONOkEfqsiWpAk8sZ2YxXd9E36nQaS9rbtbYst0cQavKlxHP6-eTfmdtDhkwOd3yKlUKvhawChlPMgO6yVc4ye2mHCnMW8kId4BaAij-aaCeCd18tEhIKY5vUJSmddRsW1ZVXrbP55VGFe1zVXQTjjZPWhwpzNLxIe8vCs7WtH9XXIio7Df0mkhzkBUxpCdJ_qfcRRcvzAOfn_yMFFIDAvrCwvVsgqx64beWJX1m_mLtaeahHFlRogPT1oJ5G1iDGpbke7waMiqgl_4Sq56LqZtdEO8eww3fEv5tKruBm3yGqSGn3Gk6BaafnVAURY_AnpyZaFsJvpzCVAP0PSzb3oKc-iUzXkin7ehaJSwkCDyIh3xvEG-k1_OOETG8zlZGawi6bNMurfKLGwc070q-a1_5pioT6A=&xkcb=SoCx-_M3ceGSDQgK4r0KbzkdCdPP&p=3&fvj=1&vjs=3
Junior Data Analyst,O2E Brands,"Remote in Vancouver, BC","Passion for data and visualization.
As part of the Business Intelligence department, you will support our business units with their data needs and collaborate…",Full-time,Posted2 days ago,2022-07-01,https://ca.indeed.com/rc/clk?jk=b72dfa35b5fdf929&fccid=47b2425a6076f68f&vjs=3
Data Analyst,HSBC,"Vancouver, BC","Good knowledge of data analytics, data visualization and good data literacy.
Using analytics and data science to unlock the value of our data; and.",Full-time,Posted13 days ago,2022-07-01,https://ca.indeed.com/rc/clk?jk=60f38ca8a7946633&fccid=04c9b139c84ea1b5&vjs=3
Health Data Analyst,BC Patient Safety & Quality Council,"Vancouver, BC","This includes receiving data from multiple sources, cleaning the data as required, analyzing the data, working with subject matter experts to identify…",Full-time,Posted2 days ago,2022-07-01,https://ca.indeed.com/company/BC-Patient-Safety-and-Quality-Council/jobs/Health-Data-Analyst-6e8004d6e06f1501?fccid=49678d9e3bd3174d&vjs=3
Data Analyst,Tetra Tech,"Remote in Vancouver, BC","Work with data from multiple sources and data sizes/granularity.
Perform data analysis and troubleshoot technical issues with platforms, performance, data…",Part-time,Posted7 days ago,2022-07-01,https://ca.indeed.com/rc/clk?jk=3363014950375e4e&fccid=997110e6d9c4c093&vjs=3
Data Analyst,Thrive Health,"Remote in Vancouver, BC","Providing technical expertise in data storage structures, data mining, and data cleansing.
Providing quality assurance of imported data.",Full-time,Posted9 days ago,2022-07-01,https://ca.indeed.com/rc/clk?jk=acd519f7e560e7d3&fccid=58867cca819a76df&vjs=3
Data Analyst,Activision,"Vancouver, BC",Collect data from tools and data sources across the business to better understand capacity usage and efficiency over time.,,Posted16 days ago,2022-07-01,https://ca.indeed.com/rc/clk?jk=386f9936baa35102&fccid=71147e0539a0a1b7&vjs=3
Data Analyst,E-xact Transactions Canada Ltd,"Remote in Vancouver, BC","Build Product Support dashboards using Kibana and data visualizations using Telemetry TV.
Design and build a suite of data analysis tools using Elastic Stack…",Full-time,Posted7 days ago,2022-07-01,https://ca.indeed.com/rc/clk?jk=12ea0cbf2fc7c6bf&fccid=a8769a0f20f2731c&vjs=3
Data Analyst (Contract),Electronic Arts,"Vancouver, BC"," Validate datasets using scripting language to identify data quality issues and data anomalies.
 Develop scripts and queries to import, manipulate, clean and…",Temporary +1,Posted30+ days ago,2022-07-01,https://ca.indeed.com/rc/clk?jk=dbea0655d2725e90&fccid=617d7f961cfcf54a&vjs=3
Reporting Analyst,Powerex,"Vancouver, BC","2-3 years’ experience in data analytics and report management.
Proven experience consolidating and analyzing data sources to create insightful business…","$85,000–$95,000 a year",Posted10 days ago,2022-07-01,https://ca.indeed.com/pagead/clk?mo=r&ad=-6NYlbfkN0A6eBa0vGWSs3AUzrLlGY9hOrjqIn5hrg_GLn7qIpz8UA0qe8JfMHuC6Wz0aMEiro3PHAf6mHi4B31cYGgcUk-v6_PUbnQgQE5FzqSx5wNc2ZORP8Ht0q8YYGI29DV1BkGyB7kabtYaa_KOWvWyv9CINeEG7YPitoUpG33MVGgmkZ2dGUHzEj5lZw63GRfzmAc1Dz6ZCSvbtxc3oaM9oVv6EJZuAs07TUj4lABB54gZ7NUMxSLa8yuHFkKPUrIgz_OIsKCvFuJ5lLzZAhGvefw_WPyRWWbtxtFxc3o7SpeQnl6hx6HZHTZNRnvoZs8-CreF5j8_WcPuv73Qz9HyicwXm8bg2pyfGTpVRs9L6GwPjmZDwmxgMvkl_5Akl31-4JVLtghvsuuSM-pez8JcTPgB06bv6hkmeeuKisdpp6J3gK5DnED8ug41Fj7hm0j05Zm_Ksa0HV2nkXAE3cP8rijUDpcJpIY-NgO7xbEsxsfE4Q==&xkcb=SoCX-_M3ceGSDSAK4r0LbzkdCdPP&p=12&fvj=1&vjs=3
"Data Analyst, Competitive Intelligence",Klue,"Remote in Vancouver, BC","The Insights' team scope covers data validation for existing sources, outsourced content, and new potential data sources.
You are an Excel and/or Python master.",Full-time,Posted30+ days ago,2022-07-01,https://ca.indeed.com/rc/clk?jk=361b26389de34a6c&fccid=97d82e5ee0248fef&vjs=3
Entry Level Consulting Analyst Development Program - Toronto...,Accenture,"Remote in Vancouver, BC","Analyze project statistics and business data to read the story behind the numbers.
Combine Artificial Intelligence with data, analytics, and automation under a…",Full-time,Posted1 day ago,2022-07-01,https://ca.indeed.com/rc/clk?jk=0ae1b21660c50727&fccid=a4e4e2eaf26690c9&vjs=3
Entry Level Consulting Analyst Development Program - Toronto...,Accenture,"Remote in Vancouver, BC","Analyze project statistics and business data to read the story behind the numbers.
Combine Artificial Intelligence with data, analytics, and automation under a…",,Posted1 day ago,2022-07-01,https://ca.indeed.com/rc/clk?jk=0ae1b21660c50727&fccid=a4e4e2eaf26690c9&vjs=3
Data Analyst,Electronic Arts,"Vancouver, BC","Perform advanced SQL querying, data mining, and data cleansing.
Collaborate effectively with Data Engineering to develop production ready data models and…",,Posted24 days ago,2022-07-01,https://ca.indeed.com/rc/clk?jk=9656bfeaff66d286&fccid=617d7f961cfcf54a&vjs=3
Data Analyst,DarkVision,"North Vancouver, BC","Inspect ultrasound data using our proprietary software to locate features and defects.
Measure and assess features in the data, utilizing machine learning…",,Posted30+ days ago,2022-07-01,https://ca.indeed.com/rc/clk?jk=344fa50fe8568820&fccid=6fdf833a92721e5d&vjs=3
Data Analyst,Zymeworks,"Remote in Vancouver, BC","Develops tools for Zymeworks’ scientific data system’s integrations, and visualization of many forms of data including scientific R&D data.",,Posted2 days ago,2022-07-01,https://ca.indeed.com/rc/clk?jk=225864da894f3bd0&fccid=e4d981a808c200d8&vjs=3
Data Analyst,REW,"Hybrid remote in Vancouver, BC","You have strong experience in data modelling and quantitative analysis, plus data analysis concepts like data visualization, dashboard design, and data mining.",,Posted29 days ago,2022-07-01,https://ca.indeed.com/rc/clk?jk=8ed8dee695d6fc9f&fccid=b3cc4f04529b54b9&vjs=3
Data Analyst - ElasticSearch,GeoComply,"Vancouver, BC","Experience in optimizing data, reduce data, aggregate data.
Experience in data preparation, data analysis, data cleaning, data transformation from multiple…",,Posted3 days ago,2022-07-01,https://ca.indeed.com/rc/clk?jk=03e37289e752f59c&fccid=894f7f8c2128ec00&vjs=3
Junior Business Analyst,Norsat International Inc.,"Richmond, BC","Develop and monitor data quality metrics and ensure business data and reporting needs are met.
Interpret, evaluate, and interrelate research data and develop…",,Posted8 days ago,2022-07-01,https://ca.indeed.com/rc/clk?jk=820d6e34e851efa7&fccid=53f485401ace992f&vjs=3
Recreation and Sport Analyst,The City of Vancouver,"Remote in Vancouver, BC","Key responsibilities include conducting, reporting, making recommendations and presenting on various types of research and analysis, such as gap and data…",,Posted2 days ago,2022-07-01,https://ca.indeed.com/rc/clk?jk=26d4a1b13495495e&fccid=3d91f889655d303e&vjs=3
"Data Analyst, Plan Administrator",Bilsland Griffith Benefit Administrators,"Burnaby, BC","Our team is made up of consultants, data analysts, pension and benefit administrators, accountants and support staff, focussing on making sure that Plan members…",,Posted3 days ago,2022-07-01,https://ca.indeed.com/company/Bilsland-Griffith-Benefit-Administrators/jobs/Data-Analyst-f2177f79851d6e89?fccid=0ebd725855684ae2&vjs=3
Senior Fire Data Analyst,The City of Vancouver,"Vancouver, BC",The Senior Fire Data Analyst is responsible for data modeling and data integration work related to the design and delivery of analytic data visualizations for…,"$89,283 a year",Posted3 days ago,2022-07-01,https://ca.indeed.com/rc/clk?jk=a41ccaa24421446b&fccid=3d91f889655d303e&vjs=3
"Supply Chain - Analyst, Supply Chain Operations",Aritzia,"New Westminster, BC","Proven skills, education, and/or applicable certifications in data analytics.
The mission of Supply Chain Operations Department is to be the planning and…",,Posted8 days ago,2022-07-01,https://ca.indeed.com/rc/clk?jk=81c38cd70afacd00&fccid=230bf53df7c46c1a&vjs=3
Marketing Data Analyst,Oppy,"Hybrid remote in Coquitlam, BC","*Schooled.* Your degree or diploma in marketing will give you a foundation to build your experience.
Complete timely analyses for sales, business development,…",,Posted3 days ago,2022-07-01,https://ca.indeed.com/company/The-Oppenheimer-Group/jobs/Marketing-Data-Analyst-6ed7008b1d9ee600?fccid=abd81d8a028da6aa&vjs=3
"Data Analyst, Courthouse Jury",Tyler Technologies,"Vancouver, BC","Previous experience in analyzing data.
Identifying patterns and trends in data sets.
Defining new data collection and analysis processes.",,Posted25 days ago,2022-07-01,https://ca.indeed.com/rc/clk?jk=d1762e750f9e964a&fccid=35fa439a19059a40&vjs=3
data analyst - informatics and systems,Quantasphere Business Solutions Inc.,"Remote in Burnaby, BC","Research and document data requirements, data collection and administration policy, and data access rules.
Operate database management systems to analyze data.",$38 an hour,Posted30+ days ago,2022-07-01,https://ca.indeed.com/rc/clk?jk=ba2d4581ea242860&fccid=4a325899619d1242&vjs=3
"Data Analyst, Marketing",Bench Accounting,"Remote in Vancouver, BC",Having a strong understanding of our business metrics and how data can be used to support strategic decision making in marketing.,"$72,720–$90,900 a year",Posted2 days ago,2022-07-01,https://ca.indeed.com/rc/clk?jk=ac8e86810d3de7b7&fccid=8050ea68bc1f1986&vjs=3
"Data Analyst, Courthouse Jury",Tyler Technologies,"Vancouver, BC","Previous experience in analyzing data.
Identifying patterns and trends in data sets.
Defining new data collection and analysis processes.",,Posted25 days ago,2022-07-01,https://ca.indeed.com/rc/clk?jk=d1762e750f9e964a&fccid=35fa439a19059a40&vjs=3
data analyst - informatics and systems,Quantasphere Business Solutions Inc.,"Remote in Burnaby, BC","Research and document data requirements, data collection and administration policy, and data access rules.
Operate database management systems to analyze data.",$38 an hour,Posted30+ days ago,2022-07-01,https://ca.indeed.com/rc/clk?jk=ba2d4581ea242860&fccid=4a325899619d1242&vjs=3
"Data Analyst, Marketing",Bench Accounting,"Remote in Vancouver, BC",Having a strong understanding of our business metrics and how data can be used to support strategic decision making in marketing.,"$72,720–$90,900 a year",Posted2 days ago,2022-07-01,https://ca.indeed.com/rc/clk?jk=ac8e86810d3de7b7&fccid=8050ea68bc1f1986&vjs=3
Consumer Data Analyst,Herschel Supply Company,"Vancouver, BC","Herschel Supply is searching for a Consumer Data Analyst to drive a data-driven approach to our marketing campaigns and support our brand, digital, and finance…",,Posted30+ days ago,2022-07-01,https://ca.indeed.com/company/Herschel-Supply-Company---Social-Engagement/jobs/Consumer-Data-Analyst-ac14f5df1145cd8d?fccid=2de679da0b404a0f&vjs=3
Inventory Analyst,Purdys Chocolatier,"Vancouver, BC","As the Inventory Analyst, primary responsibilities include but are not limited to: • Auditing and developing inventory control processes to drive continuous…",,Posted18 days ago,2022-07-01,https://ca.indeed.com/rc/clk?jk=8d327d936fe151c3&fccid=74498c43cc4d6079&vjs=3
VOC & Insights Support Analyst,WorkSafeBC,"Richmond, BC",Sourcing data from multiple sources to increase the data granularity and understanding; translating data into analytics using data warehousing programming…,$31.30–$38.91 an hour,Posted8 days ago,2022-07-01,https://ca.indeed.com/rc/clk?jk=c8ac9e63b026e7e1&fccid=3978229785e77296&vjs=3
Data Analyst,Kal Tire,"Vancouver, BC","The ability to gather, manipulate and transform data for use in reporting and research models.
Strong data engineering or ETL skills.",,Posted9 days ago,2022-07-01,https://ca.indeed.com/rc/clk?jk=8be9db5a06394a81&fccid=c288d8a94e53b663&vjs=3
Data Analyst,"Routeware, Inc","Remote in Vancouver, BC","Supporting our Customer Support team when tricky data issues arise.
Investigating data-related problems and fixing or escalating them.",,EmployerActive 5 days ago,2022-07-01,https://ca.indeed.com/company/Routeware/jobs/Data-Analyst-69b8c4902970d441?fccid=8de382f75abfcfb2&vjs=3
Master Data Analyst,West Fraser,"Vancouver, BC","Initiate data quality improvements, collect/document data quality rules and report on data quality metrics.
Experience with data analysis techniques.",,Posted3 days ago,2022-07-01,https://ca.indeed.com/rc/clk?jk=5086f85a573c2f4c&fccid=2d6618af508c37db&vjs=3
Operations Analyst,British Columbia Institute of Technology (BCIT),"Hybrid remote in Burnaby, BC","Demonstrated ability to perform data analysis and translate raw data into meaningful narrative analysis.
Assembles data and prepares analysis of the monthly…","$57,937–$62,941 a year",Posted7 days ago,2022-07-01,https://ca.indeed.com/rc/clk?jk=1bd7bca6fbf028b6&fccid=a874193b682c9f05&vjs=3
Business Analyst,Alba Inc.,"Vancouver, BC",This includes but not limited to: data remediation exercise across upstream data like trade and Counterparty reference data; good amount of UAT testing on Droit…,,EmployerActive 4 days ago,2022-07-01,https://ca.indeed.com/company/Alba-Inc./jobs/Business-Analyst-418b3cb366320bf1?fccid=31a6c93063710441&vjs=3
Data Analyst - Mobile QV,Electronic Arts,"Vancouver, BC","Validate datasets through the use of scripting language to identify data quality issues and data anomaly.
Analyze and identify potential sources of the data…",,Posted30+ days ago,2022-07-01,https://ca.indeed.com/rc/clk?jk=ad65a9dc77116b01&fccid=617d7f961cfcf54a&vjs=3
Data & Analytics - Senior Data Analyst,Aritzia,"Vancouver, BC",The mission of the Analytics Department is to provide the business with actionable and accurate information to enable data-driven decision-making.,,Posted30+ days ago,2022-07-01,https://ca.indeed.com/rc/clk?jk=26c78718fccadd77&fccid=230bf53df7c46c1a&vjs=3
DATA ANALYST,HKJ Marketing,"Richmond, BC","Perform large data set analysis that can generate actionable findings.
Excellent SQL skills; extensive experience querying large and complex data sets.",,Posted30+ days ago,2022-07-01,https://ca.indeed.com/rc/clk?jk=2eb9d8f594a1e7f9&fccid=e58d29b5855f6e22&vjs=3
"Business Operations Analyst I, AWS Commerce Platform Busines...",Amazon Dev Centre Canada ULC,"Vancouver, BC","At least 1+ years of experience with data warehousing and reporting.
The ops analyst will support customer inquiries and contribute toward immediate resolution…",,Posted30+ days ago,2022-07-01,https://ca.indeed.com/rc/clk?jk=6dc88c11efa9859a&fccid=fe2d21eef233e94a&vjs=3
DATA ANALYST,HKJ Marketing,"Richmond, BC","Perform large data set analysis that can generate actionable findings.
Excellent SQL skills; extensive experience querying large and complex data sets.",,Posted30+ days ago,2022-07-01,https://ca.indeed.com/rc/clk?jk=2eb9d8f594a1e7f9&fccid=e58d29b5855f6e22&vjs=3
"Business Operations Analyst I, AWS Commerce Platform Busines...",Amazon Dev Centre Canada ULC,"Vancouver, BC","At least 1+ years of experience with data warehousing and reporting.
The ops analyst will support customer inquiries and contribute toward immediate resolution…",Full-time,Posted30+ days ago,2022-07-01,https://ca.indeed.com/rc/clk?jk=6dc88c11efa9859a&fccid=fe2d21eef233e94a&vjs=3
Business Analyst II,Metro Vancouver,"Burnaby, BC","Assists a superior in workload planning, project scheduling and the development of corporate information technology plans including operational standards;…","$7,053–$8,351 a month",Posted3 days ago,2022-07-01,https://ca.indeed.com/rc/clk?jk=6216e4073ff3b64d&fccid=f2087428405571c4&vjs=3
Research Analyst,Destination Vancouver,"Vancouver, BC","The ideal candidate has relevant experience and expertise in a similar market research, data analytics and business insights role and understands market…",Full-time,Posted24 days ago,2022-07-01,https://ca.indeed.com/rc/clk?jk=25084a1be9124eb5&fccid=515cb0949c3e8d54&vjs=3
Business Analyst,Critical Mass,"Remote in Vancouver, BC","Use data and process modelling tools.
Use data and process modelling techniques to identify and clarify requirements.
Gather, clarify and validate requirements.",,Posted29 days ago,2022-07-01,https://ca.indeed.com/rc/clk?jk=479b6294d22e218a&fccid=4c1cecd72be0fe72&vjs=3
Data Analyst,Dorigo Systems,"Burnaby, BC","Interpret data sets using statistical tools and observe patterns or trends, cleansing the data to improve clarity.
Job Type: Full-time, Permanent, On-site.",Full-time,Posted30+ days ago,2022-07-01,https://ca.indeed.com/rc/clk?jk=72bd8e4d0aa74387&fccid=675c46b0ec9ae195&vjs=3
"Business Analyst I, Virtual Care - TELUS Health",TELUS,"Remote in Vancouver, BC","Drives market research and leverages data to drive strategic planning and develop compelling, insight-informed narratives that frame key strategic decisions (e…",Full-time,Posted23 days ago,2022-07-01,https://ca.indeed.com/rc/clk?jk=73f8dfbd4c516c1e&fccid=ed81336789a877c2&vjs=3
Senior Data Analyst,Match Group,"Remote in Vancouver, BC","Experience with raw clickstream data (telemetry event data) and datasets of 100 million+ records.
Proven technical data analytics skills in working with large…",,Posted9 days ago,2022-07-01,https://ca.indeed.com/rc/clk?jk=fa2f21d03cb2c08e&fccid=47feb0effe4ed4f2&vjs=3
database analyst,PIU SUPPLY CHAIN MANAGEMENT,"Richmond, BC",Paid time off (volunteering or personal days).,$17–$20 an hour,Posted21 days ago,2022-07-01,https://ca.indeed.com/rc/clk?jk=f9856cb471729605&fccid=32d459636de6f072&vjs=3
Senior Business Analyst - Construction PMIS - one year contr...,NPAworldwide,"Vancouver, BC","Resolves application and data integration issues as required.
Researches and identifiesopportunities to add value to the business through the technology…",Up to $112 an hour,Posted3 days ago,2022-07-01,https://ca.indeed.com/pagead/clk?mo=r&ad=-6NYlbfkN0C9BnvUC2OfFUcEeCwFAziw5WmrWmoYFT5czV5v4GtF89ANosMj2rKoMvZhBHewgwJkCd3Mh02Q70gVhkjT0ygqomsLa8vpE628ORiPl9QeoUtgsS_-fPCDtNBZuSjUm6u1hKEo5RcVQDT2dNaWUb1TrEVzkIs94Twwx-P_H5dRVWKEA8RwSMfTOVZwax-CiWk8_ry1y69yamWTWDucQsb86vT2Ck8DXX7TmwMkca6EdHFzeNtGBkNOhP70eMQeOVL6jMnRxxVR5_vkceQnXav3J44LMbs6T-d4czCcXhYX2CzxO3cyito73A1S2H7s8zse0eyo0UDRItlvoXTupRnyjEgVKIxHVAeRJmYMhlynaFC6XTw1NodDRcT2_w4elupCebQDZjH3WYvhbsbVE2bSjwJrstadnZy8RkdAzStgpAwOIgxEs9j5Bgca0q_A_qYgVS7u98kQNvw5oh0Uz_vWmxbwVgg781ns42ZSqKisF3ZYs45yU030maEp5XUcrtonpW_2aqjjW2DgIaj-kw2P&xkcb=SoD_-_M3ceGR1ARvQp0LbzkdCdPP&p=9&fvj=0&vjs=3
FL Business Analyst,Fujitsu,"Vancouver, BC","Decompose process workflows into use cases with functional definitions, logical data models and system requirements.
ServiceNow ticket and work orders creation.",Temporary +1,Posted11 days ago,2022-07-01,https://ca.indeed.com/rc/clk?jk=d42e7b79452ca22d&fccid=0d771a787e6e10bd&vjs=3
Data Analyst,QHR Technologies Inc,"Vancouver, BC","Develop SQL scripts for migrating and massaging data between data schemas.
Assess data to verify data integrity before/after data migrations.",Full-time,Posted30+ days ago,2022-07-01,https://ca.indeed.com/rc/clk?jk=bfe648cdba647d08&fccid=6be75c5e09ad4eed&vjs=3
Impact Analyst,Herschel Supply Company,"Vancouver, BC","Managing the vendor environmental data and Higg FEM platform core responsibilities (being annual data collection, data integrity, vendor communications, and…",Full-time,Posted1 day ago,2022-07-01,https://ca.indeed.com/company/Herschel-Supply-Company---Social-Engagement/jobs/Impact-Analyst-ec3e43e959cd82a3?fccid=2de679da0b404a0f&vjs=3
"Business Support Analyst, User Readiness, IMITS",PHSA,"Vancouver, BC","The position performs data gathering and analysis using multiple data analysis visualization tools, interprets and summaries results, prepares business…",$35.99 an hour,Posted2 days ago,2022-07-01,https://ca.indeed.com/rc/clk?jk=c7b76c7909756ccd&fccid=f66f721a44de3765&vjs=3
Business Analyst,Vancouver Coastal Health,"Vancouver, BC","Identifies, collects and analyses relevant data and information including industry-wide assessments and research.
Strong facilitation and education skills.",$33.35–$47.94 an hour,Posted30+ days ago,2022-07-01,https://ca.indeed.com/rc/clk?jk=69dc4efa59e5dea1&fccid=3513825c36972737&vjs=3
Single Molecule Data Analyst,ScopeSys,"Vancouver, BC","Present newly acquired key data to collaborators using your data visualization expertise.
Previous scientific research environment or experience designing,…",,EmployerActive 10 days ago,2022-07-01,https://ca.indeed.com/company/ScopeSys/jobs/Single-Molecule-Data-Analyst-6ccd80e322592641?fccid=7d11de3bf4b857a5&vjs=3
Product Business Analyst Co-op,FISPAN,"Vancouver, BC","Experience using data management tools like Excel and Google Sheets.
Our product aims to provide instant scale and reach for banks who want to remove friction…",,Posted9 days ago,2022-07-01,https://ca.indeed.com/rc/clk?jk=a65b899e2f150511&fccid=950492a34fa3df72&vjs=3
"Business Operations Analyst II, AWS Commerce Platform Busine...",Amazon Dev Centre Canada ULC,"Vancouver, BC+1 location","Ensuring accuracy of data and data analysis is of utmost importance.
Identify, design and develop data source discovery efforts across databases and identify…",,Posted30+ days ago,2022-07-01,https://ca.indeed.com/rc/clk?jk=11140ff3381964dc&fccid=fe2d21eef233e94a&vjs=3
"Business Analyst, Data & Analytics - BC Cancer Vancouver",PHSA,"Hybrid remote in Vancouver, BC","Identify issues with complex data and takes initiative in working out optimal solutions with appropriate stakeholders to improve accuracy, timelines,…",,Posted23 days ago,2022-07-01,https://ca.indeed.com/rc/clk?jk=39a64e08565bb589&fccid=f66f721a44de3765&vjs=3
Data Analyst,Gateway Casinos Corporate Office,"Burnaby, BC","Assists the corporate marketing team, develop and execute direct marketing projects / data extraction to achieve the company’s objectives regarding revenue,…",,Posted10 days ago,2022-07-01,https://ca.indeed.com/rc/clk?jk=a8343d41e9490345&fccid=1574e4fe315c5eb1&vjs=3
ISU Research Analyst,University of British Columbia,"Vancouver, BC","Experience with data analysis (e.g. health data analysis) an asset.
The analyst will work with considerable latitude with research work reviewed against…","$4,689–$6,754 a month",Posted2 days ago,2022-07-01,https://ca.indeed.com/rc/clk?jk=b76d03cb0df428b9&fccid=462e6068c17c7702&vjs=3
Data Analyst - Cell Biology,AbCellera Biologics,"Vancouver, BC","Developing and implementing software solutions for improving data flow and maintaining data standards across multiple teams.
A minimum of 3 weeks of vacation.",,Posted10 days ago,2022-07-01,https://ca.indeed.com/rc/clk?jk=e3ae52080804c807&fccid=6161745df4a18957&vjs=3
