job_title,company,job_location,job_summary,job_salary,post_date,today,job_url
"Supply Chain - Senior Analyst, Outbound Logistics",Aritzia,"New Westminster, BC","Successful candidates will be equally comfortable with both business process and data.
The mission of the Outbound Logistics Department is to manage the…",Full-time,Posted30+ days ago,2022-07-01,https://ca.indeed.com/rc/clk?jk=bf3eba4034b55e62&fccid=230bf53df7c46c1a&vjs=3
"Analyst, Business Systems",Fraser Health,"Surrey, BC","Perform data analysis and create ad hoc, operational and management reports.
Interpret business area reporting needs and develop report design layouts that…",Full-time,Posted30+ days ago,2022-07-01,https://ca.indeed.com/rc/clk?jk=b3da23af8946e227&fccid=7b6e906d0289e400&vjs=3
Quality Assurance Analyst,Pacific Blue Cross,"Burnaby, BC","Creating, selecting and loading test data and executing test plans and scripts;
Demonstrated critical thinking skills gained through the successful application…",Full-time,Posted30+ days ago,2022-07-01,https://ca.indeed.com/rc/clk?jk=edc13447bcec3f9b&fccid=5e6c2d9e10fcf23c&vjs=3
Analyst - Sales Reporting,Pages Jaunes Solutions Numériques et Médias...,"Burnaby, BC","Understand and validate various data sources and their application in order to define the data and reporting needs.
Working knowledge of Excel and PivotTables.",,Posted30+ days ago,2022-07-01,https://ca.indeed.com/rc/clk?jk=100235eea25e3610&fccid=87c785758de257e9&vjs=3
Sr Business Intelligence Engineer,Amazon Dev Centre Canada ULC,"Vancouver, BC","Build and execute on an analytics roadmap to provide data to stakeholders including finance, marketing, technology, and operations.",Full-time,Posted30+ days ago,2022-07-01,https://ca.indeed.com/rc/clk?jk=16a2e769610bd38c&fccid=fe2d21eef233e94a&vjs=3
Junior HRIS Analyst,Ledcor,"Vancouver, BC","Document procedures to ensure data integrity.
Provide support with the data flow between Workday and JD Edwards and audits on data accuracy and integrity…",Full-time,Posted11 days ago,2022-07-01,https://ca.indeed.com/rc/clk?jk=e6eb4c1ad55792cf&fccid=858565e37a126a9f&vjs=3
Enrolment & Scheduling Analyst (Leave Replacement),University of British Columbia,"Vancouver, BC","This Enrolment and Scheduling Analyst position leads the development and implementation of academic scheduling, data analysis, and records management that…","$5,906–$8,508 a month",Posted11 days ago,2022-07-01,https://ca.indeed.com/rc/clk?jk=5195fae362b9ea1a&fccid=462e6068c17c7702&vjs=3
Business Intelligence (BI) Developer- Analyst,Providence Health Care,"Vancouver, BC","Strong background in data architecture, data quality, data mapping, and data structures.
3+ years programming experience (C#, VB.net, Java, etc.).",Full-time,Posted17 days ago,2022-07-01,https://ca.indeed.com/company/Lower-Mainland-Biomedical-Engineering-(LMBME)/jobs/Business-Intelligence-Developer-e2b6a716b4f8e043?fccid=a85d37974f583371&vjs=3
Business and Contract Analyst,Vancouver Coastal Health,"Vancouver, BC","Key areas for active involvement and accountability include conducting ongoing analysis of financial and business data, identifying data requirements for…",$33.35–$47.94 an hour,Posted30+ days ago,2022-07-01,https://ca.indeed.com/rc/clk?jk=657687cd42c48337&fccid=3513825c36972737&vjs=3
Quantitative Analyst Intern (Mitacs Internship),1QBit,"Remote in Vancouver, BC","Assist in the marketing and sale of MSM subscriptions using social media and peer-to-peer outreach.
Examples of past work with data analysis and visualization…",Full-time +1,Posted30+ days ago,2022-07-01,https://ca.indeed.com/rc/clk?jk=950c1041c1607320&fccid=c3a210a74e7bf1e2&vjs=3
AWS Data Analyst / Data Engineer,Starling Minds Inc,"Vancouver, BC","Own the technical operations (data pipeline, data lake, data reporting tools) of Starling’s evolving data holdings.
Expert-level SQL query writing ability.",Full-time,Posted30+ days ago,2022-07-01,https://ca.indeed.com/rc/clk?jk=4acc7336355e887c&fccid=5cb8c5a2c227020f&vjs=3
Business and Contract Analyst,Vancouver Coastal Health,"Vancouver, BC","Key areas for active involvement and accountability include conducting ongoing analysis of financial and business data, identifying data requirements for…",$33.35–$47.94 an hour,Posted30+ days ago,2022-07-01,https://ca.indeed.com/rc/clk?jk=657687cd42c48337&fccid=3513825c36972737&vjs=3
Quantitative Analyst Intern (Mitacs Internship),1QBit,"Remote in Vancouver, BC","Assist in the marketing and sale of MSM subscriptions using social media and peer-to-peer outreach.
Examples of past work with data analysis and visualization…",,Posted30+ days ago,2022-07-01,https://ca.indeed.com/rc/clk?jk=950c1041c1607320&fccid=c3a210a74e7bf1e2&vjs=3
AWS Data Analyst / Data Engineer,Starling Minds Inc,"Vancouver, BC","Own the technical operations (data pipeline, data lake, data reporting tools) of Starling’s evolving data holdings.
Expert-level SQL query writing ability.",,Posted30+ days ago,2022-07-01,https://ca.indeed.com/rc/clk?jk=4acc7336355e887c&fccid=5cb8c5a2c227020f&vjs=3
Senior Business Data Analyst,Zscaler,"Remote in Vancouver, BC",Proven track record of executing data roadmap for support groups by translating business data needs into functional and technical requirements for the data…,,Posted28 days ago,2022-07-01,https://ca.indeed.com/rc/clk?jk=dcb289698e106ff0&fccid=b8ce556031512ca3&vjs=3
"Business Intelligence Manager, Growth Opportunities Recommen...",Amazon Dev Centre Canada ULC,"Vancouver, BC","Passion for data-driven research and inquiry.
Understanding of data engineering pipelines and building dashboards for data visualization.",,Posted30+ days ago,2022-07-01,https://ca.indeed.com/rc/clk?jk=cabb8d9ab3fb68f5&fccid=fe2d21eef233e94a&vjs=3
Senior Business Intelligence Performance Analyst,TELUS,"Vancouver, BC","Applying your creativity to solve data reporting and visualization problems.
Known as a continuous learner with a passion for technology and data.",,Posted30+ days ago,2022-07-01,https://ca.indeed.com/rc/clk?jk=a21bb2b2d3595916&fccid=ed81336789a877c2&vjs=3
Business Systems Analyst,District of North Vancouver,"North Vancouver, BC","An expert understanding of relational data structures.
Experience using SSIS, FME, or similar, for data transformation and migration.",$44.78–$52.91 an hour,Posted30 days ago,2022-07-01,https://ca.indeed.com/rc/clk?jk=cf43391d46f16303&fccid=3ef32d310a420c34&vjs=3
Business Analyst II,ZE Power Group,"Richmond, BC","Monitor data and health of ZEMA systems ensuring critical business processes execute smoothly.
ZE PowerGroup Inc. (ZE) is a global leader in developing…",,Posted23 days ago,2022-07-01,https://ca.indeed.com/company/ZE-UK-Ltd./jobs/Business-Analyst-167bd0ce97879bb8?fccid=51878304791ac00a&vjs=3
Experienced Business Analyst,Six Factor Professional Services Ltd,"North Vancouver, BC",You have a strong sense of curiosity to challenge the status quo as you engage with clients to understand how data-driven changes will affect our product…,,EmployerActive 2 days ago,2022-07-01,https://ca.indeed.com/company/Six-Factor-Professional-Services/jobs/Experienced-Business-Analyst-229218270eaed85e?fccid=1a7c666e32f95401&vjs=3
Digital Business Analyst,Saje Natural Wellness,"Vancouver, BC",Gather and prioritize both business and technical requirements from stakeholders within a roadmap project and work with each to understand the value and impact…,,Posted30+ days ago,2022-07-01,https://ca.indeed.com/rc/clk?jk=a8f2115e2f5c4ac7&fccid=19d909ae878f9a70&vjs=3
"Senior Business Analyst, Informatics/Business Intelligence,...",PHSA,"Vancouver, BC",The position will have a deep understanding of Health Authorities’ workflows and programs and will support operational and clinical program leaders in the…,,Posted2 days ago,2022-07-01,https://ca.indeed.com/rc/clk?jk=8a9e130142ba1585&fccid=f66f721a44de3765&vjs=3
Valuation Analyst,Colliers International,"Vancouver, BC","You enjoy analyzing data, gathering market research, and following a project from start to finish.
As a Valuations Analyst, you’ll apply your superior…",,Posted30+ days ago,2022-07-01,https://ca.indeed.com/rc/clk?jk=b2f635cc88e7b6e6&fccid=1a9a1146f8fe1ec1&vjs=3
Supply Chain Business Analyst,Portable Electric,"Vancouver, BC","Develop metrics that provide data for process measurement and foster a data driven culture using BI tools.
Facilitate system implementation and data migration…",,Posted6 days ago,2022-07-01,https://ca.indeed.com/rc/clk?jk=ef07193d094e7803&fccid=5251f33454c24c11&vjs=3
Credit Risk Analyst II,HSBC,"Vancouver, BC","Experience in data management, data processing and data analysis.
Advanced proficiency in the use of SAS as well as excellent data presentation skills.",,Posted28 days ago,2022-07-01,https://ca.indeed.com/rc/clk?jk=8c20afa3506a1c0d&fccid=04c9b139c84ea1b5&vjs=3
Accounts Receivable Analyst,WestCorp Solutions,"Vancouver, BC","Investigate claims of incorrect invoicing data relating to Downstream customers.
Resolve invoicing data errors, dispatching work to the appropriate support…",,Posted14 days ago,2022-07-01,https://ca.indeed.com/rc/clk?jk=0168fe6aafd9d0e8&fccid=6aae2c1ce6f2643d&vjs=3
database analyst,KAN Security Inc.,"Surrey, BC","Research and document data requirements, data collection and administration policy, and data access rules.
Operate database management systems to analyze data.",$38 an hour,Posted30+ days ago,2022-07-01,https://ca.indeed.com/rc/clk?jk=f2fea6348da1d97c&fccid=083cc5fd66fca8b6&vjs=3
Enterprise Analytics Analyst,Stantec,"Vancouver, BC","6-8 years of data analytics/data visualization experience.
Solid understanding of data and database technologies (data analysis, data preparation, ETL, etc.)…",,Posted18 days ago,2022-07-01,https://ca.indeed.com/rc/clk?jk=14589ccdf6343d39&fccid=f1582c464db8553b&vjs=3
Business Analyst,SNC-Lavalin,"Vancouver, BC","Well versed in best practices for information management, assurance and security including data standards, reporting and analytics.",,Posted30+ days ago,2022-07-01,https://ca.indeed.com/rc/clk?jk=fcebdf2562eb5230&fccid=59b04a51f1164f7e&vjs=3
Business Analyst,Canstar Fire and Flood,"Coquitlam, BC","Intermediate proficiency with MS Office applications, data analysis tools, and ERP systems.
Experience with DW development, data analysis and report writing …",,Posted15 days ago,2022-07-01,https://ca.indeed.com/rc/clk?jk=14afaabe4aa1d8c2&fccid=804970d9771d56c9&vjs=3
"Sr. Analyst, Marketing Analytics",Electronic Arts,"Vancouver, BC","We are looking for someone who can take our analytics to a new level by digging into diverse data sets relating to our marketing campaigns, applying leading…",,Posted30+ days ago,2022-07-01,https://ca.indeed.com/rc/clk?jk=5144c1cd28a5d010&fccid=617d7f961cfcf54a&vjs=3
"Business Intelligence Engineer, Fulfillment Availability Ana...",Amazon Dev Centre Canada ULC,"Vancouver, BC+10 locations",Expert in writing and tuning SQL scripts Expert in Causal Analysis Experience working in very large data warehouse environments Experience in a data engineer or…,,Posted14 days ago,2022-07-01,https://ca.indeed.com/rc/clk?jk=feb25be3107e73cc&fccid=fe2d21eef233e94a&vjs=3
SAP Success Factors Business Analyst,The City of Vancouver,"Remote in Vancouver, BC","Has access to highly sensitive and business critical data from all City departments (e.g. employee and payroll records).
Employment Type: Temporary Full Time.",,Posted14 days ago,2022-07-01,https://ca.indeed.com/rc/clk?jk=edf67f8d187514c1&fccid=3d91f889655d303e&vjs=3
Compliance Analyst,GeoComply,"Vancouver, BC","Analytical and detail-oriented, with a passionate for data analysis.
As the Compliance Analyst you will be the trusted source of assessing compliance risks…",,Posted3 days ago,2022-07-01,https://ca.indeed.com/rc/clk?jk=51300651441994a4&fccid=894f7f8c2128ec00&vjs=3
Business Operations Analyst II,"Amazon Web Services Canada, In","Vancouver, BC","Ensuring accuracy of data and data analysis is of utmost importance.
Identify, design and develop data source discovery efforts across databases and identify…",,Posted30+ days ago,2022-07-01,https://ca.indeed.com/rc/clk?jk=a2c03d34f5aca1ab&fccid=5cc0cdc6dbb121cc&vjs=3
"Senior Analyst, Primary Health Care",First Nations Health Authority,"Metro Vancouver Regional District, BC","Writes scripts using SQL, R, Python, and other tools to automate data cleansing and analysis from diverse data sources, including SQL data warehouse, text data…",,Posted30+ days ago,2022-07-01,https://ca.indeed.com/company/First-Nations-Health-Authority/jobs/Senior-Analyst-fb5d059da0a7fc46?fccid=1897f041fff8f056&vjs=3
Business Intelligence Developer,Graymont,"Hybrid remote in Richmond, BC",This includes diving deep into business data to identify data sources and to provide new data-driven insights to challenging business problems.,,Posted2 days ago,2022-07-01,https://ca.indeed.com/rc/clk?jk=8cec29938af261c6&fccid=809c5d973b59d132&vjs=3
Senior Economics Analyst,Steer Group,"Vancouver, BC","Excellent technical skills related to data analytics or technical analysis in the transportation sector;
Leading and undertaking econometrics and technical…",,EmployerActive 15 days ago,2022-07-01,https://ca.indeed.com/company/Steer-Group/jobs/Senior-Economic-Analyst-987c6929351e590a?fccid=4937274592f734f4&vjs=3
Inventory Analyst,WestCorp Solutions,"Vancouver, BC",Create the monthly report of crude and refined inventory valuation based on First-in First-out (FIFO) methodology and for the quarterly net realizable value …,,Posted14 days ago,2022-07-01,https://ca.indeed.com/rc/clk?jk=bfefa4834c91fbb6&fccid=6aae2c1ce6f2643d&vjs=3
"Business Analyst, Accounts Receivable",Fraser Health,"New Westminster, BC","Demonstrated skills in data research, gathering, modeling, and business and systems analysis.
We currently have an exciting Full Time Business Analyst…",,Posted30+ days ago,2022-07-01,https://ca.indeed.com/rc/clk?jk=bfa9a4912a25bf34&fccid=7b6e906d0289e400&vjs=3
Business Analyst,O2E Brands,"Hybrid remote in Vancouver, BC","Comfortable working with large sets of data.
Proficiency with data-query languages (SQL/SOQL) is a plus.
Partner with internal functional departments as well as…",,Posted30+ days ago,2022-07-01,https://ca.indeed.com/rc/clk?jk=b600e2ae4746f5f9&fccid=47b2425a6076f68f&vjs=3
SYSTEMS ANALYST,AdamSea Inc.,"Vancouver, BC","3 years to less than 5 years.
Confer with clients to identify and document requirements.
Conduct business and technical studies.",$38.34 an hour,Posted16 days ago,2022-07-01,https://ca.indeed.com/rc/clk?jk=3b434fd0820662e5&fccid=cbf0818f2dfce14c&vjs=3
IT Business Analyst,Green PI Inc on behalf of City of Burnaby,"Remote in Burnaby, BC","Works with other business analysts on the project to identify critical interdependencies.
Experience as a digital strategist, of implementing data-driven…",,Posted1 day ago,2022-07-01,https://ca.indeed.com/company/Green-PI-Inc/jobs/IT-Business-Analyst-d21319b27985f697?fccid=54eaa060feecd7f7&vjs=3
Senior Business Analyst - Consumer Health - Reporting Transf...,TELUS,"Vancouver, BC","You are known for your analytical expertise and data driven approach.
You are proficient in connecting the dots between various data sets to drive conclusions.",Full-time,Posted30+ days ago,2022-07-01,https://ca.indeed.com/rc/clk?jk=967088bf29f31e48&fccid=ed81336789a877c2&vjs=3
Senior Game Data Analyst,Kabam,"Vancouver, BC","Finding answers to business questions via hands-on exploration of data sets using SQL, dashboards, statistical analysis, and data visualizations.",Full-time,Posted30+ days ago,2022-07-01,https://ca.indeed.com/rc/clk?jk=e848c70190d28922&fccid=fde47f06a6b44d5e&vjs=3
Senior HR Forecaster/Business Intelligence Analyst,Providence Health Care,"Vancouver, BC","Providing input into the development and implementation of policies and procedures for data stewardship and data governance.
2021 BC’s Top Employers.",Full-time,EmployerActive 3 days ago,2022-07-01,https://ca.indeed.com/company/Lower-Mainland-Biomedical-Engineering-(LMBME)/jobs/Senior-Human-Resource-Forecaster-Business-Intelligence-Analyst-fdc2e21427302f3e?fccid=a85d37974f583371&vjs=3
Senior Business Analyst,Axiom Builders,"Vancouver, BC","Use data and building models to help support research and hypotheses;
Research and identify strategic opportunities to add value to the business through the…",Full-time,Posted30+ days ago,2022-07-01,https://ca.indeed.com/rc/clk?jk=e917e3dbc1e690ba&fccid=4d2685886e2b4e35&vjs=3
"Senior Business Systems Analyst, Scotia Digital(Vancouver Hu...",Scotiabank,"Remote in Vancouver, BC","Familiarity of batch integration patterns, secure file transfer protocols, data security standards.
At Scotiabank, we value the unique skills and experiences…",,Posted23 days ago,2022-07-01,https://ca.indeed.com/rc/clk?jk=7a2bbb57025fb57d&fccid=3002307a9e5b4706&vjs=3
"Senior Business Analyst, Business Improvement",Ledcor,"Remote in Vancouver, BC","Establish key performance indicators, as well as methods for collecting / reporting key financial and operational data.
Do you want a career that means more?",Full-time,Posted30+ days ago,2022-07-01,https://ca.indeed.com/rc/clk?jk=6b2e16be05fc8b54&fccid=858565e37a126a9f&vjs=3
Cova - QA Analyst,Cova Software,"Vancouver, BC","Experience writing test plans and creating test data.
3+ years of experience in a QA analyst or similar role.
After launching commercially less than 4 years ago…",Full-time,Posted30+ days ago,2022-07-01,https://ca.indeed.com/rc/clk?jk=840aa3c44799f5ce&fccid=1ac067382dedbfb8&vjs=3
Workforce Management Analyst,Hootsuite,"Vancouver, BC","Demonstrated experience working in workforce management analyst capacity with.
Advanced knowledge in workforce methodologies and data analysis in a multichannel…",,Posted23 days ago,2022-07-01,https://ca.indeed.com/rc/clk?jk=0b26d4faa9fbe3a9&fccid=cc35cdc10c90c921&vjs=3
Senior Business Analyst - TELUS Custom Security Systems,TELUS,"Vancouver, BC","To enable this mandate, our team collaborates with finance, sales and marketing stakeholders to make critical decisions on how best to measure our business and…",Full-time,Posted14 days ago,2022-07-01,https://ca.indeed.com/rc/clk?jk=6e258c230741bd3a&fccid=ed81336789a877c2&vjs=3
Business Intelligence Analyst,iComply,"Vancouver, BC","Have a marketing or business degree or diploma or equivalent, with 2 years of business development and marketing experience in a professional services…",Full-time,Posted30+ days ago,2022-07-01,https://ca.indeed.com/rc/clk?jk=a461c4fd895f1312&fccid=fcf89bf984002948&vjs=3
"Senior Data Engineer - AWS Product BI, AWS Product BI",Amazon Dev Centre Canada ULC,"Vancouver, BC+1 location","Designing and planning for solutions in the various engineering subject areas as it relates to data storage and movement solutions: data warehousing, enterprise…",Full-time,Posted30+ days ago,2022-07-01,https://ca.indeed.com/rc/clk?jk=53284beb2cc86c5f&fccid=fe2d21eef233e94a&vjs=3
Prospect Development Analyst,"Covenant House Vancouver - Vancouver, BC","Vancouver, BC","Knowledge of latest research products and ethical data collection strategies an asset.
Participate in donor strategy sessions and recommend research strategies…",Full-time,EmployerActive 3 days ago,2022-07-01,"https://ca.indeed.com/company/Covenant-House-Vancouver---Vancouver,-BC/jobs/Prospect-Development-Analyst-1ad6687240fe0e2c?fccid=499ab6d1074d4398&vjs=3"
"Statistical Analyst - Term Until March 31, 2023",First Nations Health Authority,"Metro Vancouver Regional District, BC","Knowledge of survey data collection methodology, research, and analysis methods and approaches.
Represents FNHA as required on internal or external data…",Temporary +1,Posted16 days ago,2022-07-01,https://ca.indeed.com/rc/clk?jk=58cd665adb0d11d0&fccid=1468513ebc10d6b8&vjs=3
"Senior Data Engineer - AWS Product BI, AWS Product BI",Amazon Dev Centre Canada ULC,"Vancouver, BC+1 location","Designing and planning for solutions in the various engineering subject areas as it relates to data storage and movement solutions: data warehousing, enterprise…",,Posted30+ days ago,2022-07-01,https://ca.indeed.com/rc/clk?jk=53284beb2cc86c5f&fccid=fe2d21eef233e94a&vjs=3
Prospect Development Analyst,"Covenant House Vancouver - Vancouver, BC","Vancouver, BC","Knowledge of latest research products and ethical data collection strategies an asset.
Participate in donor strategy sessions and recommend research strategies…",,EmployerActive 3 days ago,2022-07-01,"https://ca.indeed.com/company/Covenant-House-Vancouver---Vancouver,-BC/jobs/Prospect-Development-Analyst-1ad6687240fe0e2c?fccid=499ab6d1074d4398&vjs=3"
"Statistical Analyst - Term Until March 31, 2023",First Nations Health Authority,"Metro Vancouver Regional District, BC","Knowledge of survey data collection methodology, research, and analysis methods and approaches.
Represents FNHA as required on internal or external data…",,Posted16 days ago,2022-07-01,https://ca.indeed.com/rc/clk?jk=58cd665adb0d11d0&fccid=1468513ebc10d6b8&vjs=3
HR Systems and Reporting Analyst,Ritchie Bros.,"Hybrid remote in Burnaby, BC","You will need to analyze the data, find trends and determine what the data is really telling us.
Analytical Skills & Critical thinking: HRIS analysts work with…",,Posted30+ days ago,2022-07-01,https://ca.indeed.com/rc/clk?jk=8d79e2856c562cad&fccid=143c7479acc5b806&vjs=3
Software Engineer- Data Visualization Consultant,ProCogia,"Vancouver, BC","Knowledgeable and passionate about data visualization.
Collect feedback to make continuous improvements to new and existing data visualizations.",,Posted4 days ago,2022-07-01,https://ca.indeed.com/company/ProCogia/jobs/Software-Engineer-d2188357758f46b8?fccid=b3e3dabad95297e4&vjs=3
Business Intelligence Analyst,KORE Software,"Remote in Vancouver, BC","The focus will be on problem solving for clients using data to create analytics solutions and data visualizations (SQL, Tableau, PowerBI).",,EmployerActive 24 days ago,2022-07-01,https://ca.indeed.com/rc/clk?jk=b3cb3ad7043bc217&fccid=6471263aeaa89116&vjs=3
information technology (IT) business analyst,Nirvana Info Com Inc.,"Burnaby, BC","Assess physical and technical security risks to data, software and hardware.
Confer with clients to identify and document requirements.",$37 an hour,Posted30+ days ago,2022-07-01,https://ca.indeed.com/rc/clk?jk=d6f738dffc5506ae&fccid=80f292fd838352f7&vjs=3
"Analyst, Trade Management","Sysco Canada, Inc","Remote in Vancouver, BC","Set up and run data reports.
Analyze data as required to build meaningful Business Reviews for National customers.",,Posted15 days ago,2022-07-01,https://ca.indeed.com/rc/clk?jk=340c83a8a471634c&fccid=053befe8409ab9e4&vjs=3
Quality Control Analyst,STEMCELL Technologies,"Vancouver, BC","Perform data analysis, generate reports, and communicate findings across departments.
Conduct rigorous quality control testing of our media and cell separation…",,Posted30+ days ago,2022-07-01,https://ca.indeed.com/rc/clk?jk=75df48ee51019692&fccid=1495fd2cb143fcaf&vjs=3
Senior Sales Operations Analyst,Xero,"Vancouver, BC","Proven record conducting data analysis and providing insights via excel or other tools (BI, SQL).
The Sales Operations Analyst will be embedded in our…",,Posted30+ days ago,2022-07-01,https://ca.indeed.com/rc/clk?jk=df3e694334db88be&fccid=939f734123daf0a9&vjs=3
ServiceNow Business System Analyst (BSA),MJB Technology Solutions Ltd.,"Vancouver, BC","_Candidate must have good / fluent communications skills in English (Listening, Speaking, Reading, Writing __and Conversating)._.",$45–$65 an hour,EmployerActive 4 days ago,2022-07-01,https://ca.indeed.com/company/MJB-Technology-Solutions-Ltd./jobs/Servicenow-Business-System-Analyst-ca881d967c0c0bd7?fccid=18afab442127167f&vjs=3
business systems analyst,Cilver Solutions Inc.,"Surrey, BC","Assess physical and technical security risks to data, software and hardware.
Confer with clients to identify and document requirements.",$39 an hour,Posted30+ days ago,2022-07-01,https://ca.indeed.com/rc/clk?jk=2c2fb62cfd090392&fccid=a18719dbaca32064&vjs=3
Senior Business Analyst (BHJOB13022_12273),Ignite Technical Resources.,"Vancouver, BC","Performs data analysis and data modeling as required.
Knowledge of data analysis and data modeling (conceptual, logical).",,Posted2 days ago,2022-07-01,https://ca.indeed.com/rc/clk?jk=bcc11213f16c6ae0&fccid=e671f6b2e57dc9e3&vjs=3
Treasury Analyst,BlueShore Financial,"North Vancouver, BC","High proficiency with Excel and a high level of data literacy.
Preparation of data extracts and analyses for asset and liability management forecasting.",,Posted11 days ago,2022-07-01,https://ca.indeed.com/company/BlueShore-Financial/jobs/Treasury-Analyst-ede3ea17fc79a236?fccid=be9414fd46d6c4d2&vjs=3
"Business Analyst, Commercial Mortgage Operations",CMLS Financial,"Vancouver, BC","Business Intelligence: data gathering, analysis and research, identifying opportunities for process improvement and reporting.",,Posted30+ days ago,2022-07-01,https://ca.indeed.com/rc/clk?jk=3f570b55cbe8461e&fccid=75006dd589f3e419&vjs=3
Senior Business Analyst (BHJOB13022_12273),Ignite Technical Resources.,"Vancouver, BC","Performs data analysis and data modeling as required.
Knowledge of data analysis and data modeling (conceptual, logical).",,Posted2 days ago,2022-07-01,https://ca.indeed.com/rc/clk?jk=bcc11213f16c6ae0&fccid=e671f6b2e57dc9e3&vjs=3
Treasury Analyst,BlueShore Financial,"North Vancouver, BC","High proficiency with Excel and a high level of data literacy.
Preparation of data extracts and analyses for asset and liability management forecasting.",,Posted11 days ago,2022-07-01,https://ca.indeed.com/company/BlueShore-Financial/jobs/Treasury-Analyst-ede3ea17fc79a236?fccid=be9414fd46d6c4d2&vjs=3
